<?xml version="1.0" encoding="UTF-8" ?>
<FuzzyDate
        xmlns:xsi="http://www.w3.org/2001/XMLSchema-instance"
        xsi:noNamespaceSchemaLocation="file://FuzzyDate.xsd">
    <ParseDefaults>
        <caseSensitive>false</caseSensitive>
        <resolverStyle>LENIENT</resolverStyle>
        <locales>en_US</locales>
        <filter></filter>
    </ParseDefaults>
    <Instant>
        <try predefined="true">ISO_INSTANT</try>
    </Instant>
    <OffsetDateTime>
        <try>uuuu-M-d'T'HH:mm[:ss]X</try>
        <try>uuuu/M/d'T'HH:mm[:ss]X</try>
        <try>uuuu-M-d HH:mm[:ss]X</try>
        <try>uuuu/M/d HH:mm[:ss]X</try>
        <try predefined="true">ISO_DATE_TIME</try>
        <try predefined="true">RFC_1123_DATE_TIME</try>
    </OffsetDateTime>
    <LocalDateTime>
        <try>uuuu-M-d HH:mm[:ss]</try>
        <try>uuuu/M/d HH:mm[:ss]</try>
        <try predefined="true">ISO_LOCAL_DATE_TIME</try>
        <try>uuuuMMddHHmmss</try>
        <try>yyyy年MM月dd日 hh时mm分ss秒</try>
    </LocalDateTime>
    <LocalDate>
        <try>d-MMM-uuuu</try>
        <try>uuuu-M-d</try>
        <try>uuuu/M/d</try>
        <try>uuuu M d</try>
        <try>uuuu-MMM-d</try>
        <try>uuuu/MMM/d</try>
        <try>uuuu MMM d</try>
        <try predefined="true">ISO_LOCAL_DATE</try>
        <try predefined="true">BASIC_ISO_DATE</try>
        <try>uuuu M d</try>
        <try>yyyy年mm月dd日</try>
    </LocalDate>
    <YearMonth>
        <try>MMM/uuuu</try>
        <try>MMM-uuuu</try>
        <try>uuuu-M</try>
        <try>uuuu/M</try>
    </YearMonth>
    <Year>
        <try>uuuu</try>
        <try filter="nl.naturalis.common.time.YearFilter">uuuu</try>
    </Year>
</FuzzyDate>